Title,Active Golfers,Entries,URL
awesome VimGolf challenge: SQL to YAML @,20,45,https://www.vimgolf.com/challenges/56fcc3204a7725120c00c91c
awesome VimGolf challenge: Tiny column alignment @,19,41,https://www.vimgolf.com/challenges/555b647e6337c25795003d2c
awesome VimGolf challenge: Extended Customer 2 @,19,44,https://www.vimgolf.com/challenges/51330725b051320002000042
awesome VimGolf challenge: 50 factorials mod 97 @,18,47,https://www.vimgolf.com/challenges/54d6ed13bb73ec0688000001
awesome VimGolf challenge: simple format (3) @,18,60,https://www.vimgolf.com/challenges/5bff6e560d5dc0000ca3485b
awesome VimGolf challenge: Lower cased and dashed strings @,18,46,https://www.vimgolf.com/challenges/55f9720b4a665c2acf0008c8
awesome VimGolf challenge: JSON string rotation @,18,51,https://www.vimgolf.com/challenges/548879e3844403000250b6aa
awesome VimGolf challenge: Config Sections @,18,38,https://www.vimgolf.com/challenges/5474ef0bcf59b600024c64de
awesome VimGolf challenge: Permutations N=4 @,18,60,https://www.vimgolf.com/challenges/5287aac7bba8eb0002000002
awesome VimGolf challenge: Conway sequence @,18,23,https://www.vimgolf.com/challenges/54f8cc2718a13f0a630041e5
awesome VimGolf challenge: LaTeX to XML Math Delimiters @,18,40,https://www.vimgolf.com/challenges/510a052c6db41b0002000028
awesome VimGolf challenge: On Being Stylish @,18,71,https://www.vimgolf.com/challenges/5b7d2a7a55b986000cd6e00f
awesome VimGolf challenge: Double and switch @,17,37,https://www.vimgolf.com/challenges/584dd156842bd00769000001
awesome VimGolf challenge: Under the cupola @,17,45,https://www.vimgolf.com/challenges/5223a618e52582000200005c
awesome VimGolf challenge: Recursive Cowsay @,17,58,https://www.vimgolf.com/challenges/521df209452feb000200012d
awesome VimGolf challenge: XML to JSON @,17,44,https://www.vimgolf.com/challenges/50ea3ca82bf6290002000040
awesome VimGolf challenge: Sort yaml structures alphabetically by root key names  @,17,35,https://www.vimgolf.com/challenges/5a390183530db00e38000001
awesome VimGolf challenge: Count to 100 in word form @,17,54,https://www.vimgolf.com/challenges/6010dc493e0f8d0009eddcf9
awesome VimGolf challenge: Binary and Increment @,17,43,https://www.vimgolf.com/challenges/549fc5c05874e9000220eb54
awesome VimGolf challenge: snowflake fractal @,17,39,https://www.vimgolf.com/challenges/5c6c5d89eba29c00068b77f8
awesome VimGolf challenge: 199 Fibonacci Numbers @,16,37,https://www.vimgolf.com/challenges/511d618c094242000200001a
awesome VimGolf challenge: Create bison tokens @,16,34,https://www.vimgolf.com/challenges/5675405ac5936f0ba3000002
awesome VimGolf challenge: Kolakoski sequence -- level 1 @,16,57,https://www.vimgolf.com/challenges/5c880211ab65cb00065c74eb
awesome VimGolf challenge: Convert regular pandoc footnotes to in-line notes @,16,60,https://www.vimgolf.com/challenges/5014b2156318a4000200000b
awesome VimGolf challenge: Custom McCarthy sequence @,15,36,https://www.vimgolf.com/challenges/55213dc25709ea0851015904
awesome VimGolf challenge: Pascal's Triangle @,15,34,https://www.vimgolf.com/challenges/5ca2bc786b547e000c77fd52
awesome VimGolf challenge: ascii-art diamond @,15,35,https://www.vimgolf.com/challenges/57a4ec036f04c40bf8000001
awesome VimGolf challenge: Label grid cells (6x6) @,15,34,https://www.vimgolf.com/challenges/5d6aa7f288ff50000c123d49
awesome VimGolf challenge: The  D a n k  Side of the Moon @,14,40,https://www.vimgolf.com/challenges/5c75b4246c2f8300092b8d97
awesome VimGolf challenge: No naked if allowed! @,14,25,https://www.vimgolf.com/challenges/565bb80fceffe53baa038f0c
awesome VimGolf challenge: Palindrome numbers @,14,21,https://www.vimgolf.com/challenges/5986e7e8d6a38f049d000005
awesome VimGolf challenge: Write Hello World in the 'i use arch btw' -programming language @,14,29,https://www.vimgolf.com/challenges/9v0060a1b5ed000000000204
awesome VimGolf challenge: C# data class to F# record @,14,56,https://www.vimgolf.com/challenges/5ed1805d1e2d61000670078f
awesome VimGolf challenge: Solve anagram with ASCII letters @,14,31,https://www.vimgolf.com/challenges/9v00611f700a00000000020d
awesome VimGolf challenge: Hail to Alekse Pajitnov @,13,33,https://www.vimgolf.com/challenges/548c6254c3fe990002bb28f7
awesome VimGolf challenge: Sort with uniq OpenEmbedded package names @,13,33,https://www.vimgolf.com/challenges/54d5f51d20b05716be00036d
awesome VimGolf challenge: 42-header @,13,36,https://www.vimgolf.com/challenges/5a19a6be19128f03c2000010
awesome VimGolf challenge: Forgot to follow the naming convention... @,13,25,https://www.vimgolf.com/challenges/55ff7ea45a2b52043e06dee2
awesome VimGolf challenge: C to VimDict @,13,46,https://www.vimgolf.com/challenges/54a94976f4048c00026d8ed6
awesome VimGolf challenge: Maze path @,13,32,https://www.vimgolf.com/challenges/55b35f751b16ea1bc100a0e2
awesome VimGolf challenge: citizen_hacks_2019_part1 @,13,35,https://www.vimgolf.com/challenges/5d745e0e9a72d6000c5eb78d
awesome VimGolf challenge: sort python functions and methods alphabetically @,12,21,https://www.vimgolf.com/challenges/5a2808ee8e67cc0006000002
awesome VimGolf challenge: Convert pasted text into Markdown @,12,21,https://www.vimgolf.com/challenges/56f8745e27bf6e0006010ec1
awesome VimGolf challenge: Simple Maths 2 @,11,27,https://www.vimgolf.com/challenges/5cfd02e3837727000c3ebe53
awesome VimGolf challenge: Rule 110 @,11,35,https://www.vimgolf.com/challenges/5cfc4d8b83772700093ebbc0
awesome VimGolf challenge: mp3 - Cutlist @,11,28,https://www.vimgolf.com/challenges/5a0f4f6591974a039c000007
awesome VimGolf challenge: TAR archive pretty print @,10,22,https://www.vimgolf.com/challenges/5a19a46019128f000900001e
awesome VimGolf challenge: Converting group lines from format A to Format B  @,10,20,https://www.vimgolf.com/challenges/59e19a18396b000053000013
awesome VimGolf challenge: RUST HTML to maud. @,9,17,https://www.vimgolf.com/challenges/5fe3ddcb8a967b00099d7e59
awesome VimGolf challenge: If-then-else regexp @,9,37,https://www.vimgolf.com/challenges/5d010a4fcb4b5c000927f42a
awesome VimGolf challenge: C# function to F# @,8,22,https://www.vimgolf.com/challenges/5ed25358070f0e0006193c04
awesome VimGolf challenge: Flatten repo @,8,22,https://www.vimgolf.com/challenges/598728b4d6a38f049d00000f
awesome VimGolf challenge: Long prime list - filter version @,8,26,https://www.vimgolf.com/challenges/5b07e46e497a8a000c00000f
awesome VimGolf challenge: Comparing Schema With Diff  @,8,50,https://www.vimgolf.com/challenges/5da1fae264d6990006137c21
awesome VimGolf challenge: citizen_hacks_2019_part6 @,8,19,https://www.vimgolf.com/challenges/5d745ebe9a72d6000c5eb793
awesome VimGolf challenge: citizen_hacks_2019_part9 @,7,17,https://www.vimgolf.com/challenges/5d745f6f9a72d600065eb79f
awesome VimGolf challenge: citizen_hacks_2019_part5 @,7,15,https://www.vimgolf.com/challenges/5d745ea09a72d600095eb7b0
awesome VimGolf challenge: citizen_hacks_2019_part4 @,7,10,https://www.vimgolf.com/challenges/5d745e799a72d600095eb7af
awesome VimGolf challenge: citizen_hacks_2019_part2 @,7,18,https://www.vimgolf.com/challenges/5d745e309a72d6000c5eb78e
"awesome VimGolf challenge: vimtutor, but you can cheat @",7,15,https://www.vimgolf.com/challenges/5fc320b30575c20009ac2527
awesome VimGolf challenge: [Real World] PHP To Markdown @,7,25,https://www.vimgolf.com/challenges/5caf08f4a1c3e10009f19429
awesome VimGolf challenge: Kolakoski sequence -- level 2 @,6,10,https://www.vimgolf.com/challenges/5c9f68afe73f870006154904
awesome VimGolf challenge: Lenny Spiral @,6,13,https://www.vimgolf.com/challenges/5a4c89ccf061980006000003
awesome VimGolf challenge: My cafe needs a new menu @,5,22,https://www.vimgolf.com/challenges/5c1db460c5949f000990a2f1
awesome VimGolf challenge:    (Combine Hangul and Chinese characters) @,5,27,https://www.vimgolf.com/challenges/5fe14618f5abb00009be3ace
awesome VimGolf challenge: citizen_hacks_2019_part3 @,5,15,https://www.vimgolf.com/challenges/5d745e539a72d600095eb7ad
awesome VimGolf challenge: Splits long lines in more readable ones @,4,10,https://www.vimgolf.com/challenges/5aa7e13aa19abd00c800000b
awesome VimGolf challenge: Back to the Future @,2,3,https://www.vimgolf.com/challenges/5dd30310d8d0f900069f675f
